風險類型,具體風險,風險描述及影響,時間範圍,風險程度,應對措施
,"更嚴格的範圍一、
範圍二以及範圍三
溫室氣體排放披露
要求","為實現雙碳目標，中國內
地和香港政府以及相關
監管機構對企業範圍一、
範圍二以及範圍三溫室氣
體排放的披露要求越來越
高，可能導致企業合規成
本增加。","短期
中期",低,"• 及時跟進最新溫室氣
體排放監管要求，完
善溫室氣體收集體
系，披露溫室氣體排
放並確保合規"
技術風險,低碳技術轉型開支,"在全球氣候變化背景下，
企業需要向低碳營運轉
型，包括研究和開發新技
術（如數字化信息技術），
以及改用新能源╱節能設
備以替換傳統╱高耗能、
落後設備等，都可能導致
運營成本增加。","中期
長期",低,"• 上線十大數字化「雲」
系統，運用大數據實
現數字化運營
• 加快物流車輛新能源
化的步伐"
市場風險,客戶行為變化,"越來越多客戶傾向於使用
環境友好的產品和服務，
企業需要投入更多成本以
提高自身產品和服務的能
源使用效率，避免因未滿
足市場需求而降低企業競
爭力，影響收入。",中期,非常低,"• 與客戶保持密切溝
通，及時了解其需求
• 積極採取節能減排措
施，不斷提升自身產
品及服務的能源使用
效率，並減少溫室氣
體排放"
聲譽風險,"利益相關方對負面
反饋日益關切","社會對氣候變化相關的問
題日益關切，公司及其供
應商若在氣候變化相關的
事宜上出現負面信息，將
會影響企業聲譽。","中期
長期",高,"• 與利益相關方宣揚公
司環保理念
• 監控公司及其供應商
在氣候變化事宜上的
負面報道
• 若供應商在氣候變化
相關事宜上出現負面
信息，公司將對其負
面信息相關的風險進
行評估，並根據評估
結果採取措施"
