個案研究,,
,,實現穩定的能源轉型
,,"澳洲新南威爾斯州政府承諾在2035年底前，減少溫室氣體排放量70%，並在2050年底前實現淨零排放。這
個澳洲人口最稠密的州份正在加快發展可再生能源，而靈活的發電容量是實現穩定能源轉型的關鍵。
當EnergyAustralia的Tallawarra B電廠投產時，這所快速啟動的新燃氣發電廠將肩負重任，提供靈活的發電
容量，配合新南威爾斯州繼續發展供應不穩定的可再生能源。
Tallawarra B電廠預計將輸出約320兆瓦的可調度容量，可於高峰用電需求期間供電予約18萬個家庭和小型
企業，並在天然資源匱乏而削弱風能及太陽能發電量時，為市場提供可靠的電力。
該電廠將是澳洲首座淨零排放燃氣發電廠，可在運行期限內全面抵銷所有直接產生的碳排放。
Tallawarra B電廠採用最新的渦輪機技術，是澳洲最高效的燃氣發電設施之一，其環保表現預期可進一步改
善。EnergyAustralia計劃引進技術，在氫氣供應充足的情況下，將Tallawarra B電廠燃料組合中的天然氣混
氫比例，於2025年底前提升至最高5%。
於2023年底，EnergyAustralia完成Tallawarra B電廠首次成功點火，標誌著電廠全面投產前的一個重要里
程碑。此項目克服了重重困難，包括2021年於疫情封鎖期間動工，以及因項目主要承建商Clough Limited
財困而使施工進度受阻，其後承建商於2022年進入破產管理程序。"
,,
