,"成員
可持續發展委員會由獨立非執行董事擔任主席，委員會由七名非執行董事組成，
其中包括主席在內的五名成員為獨立非執行董事。可持續發展委員會成員由中電控股董事會委任，
負責監督中電的可持續發展議題，於報告期內
（2023全年度及2024年截至本報告日期止）（有關期間）的成員為：",
,"顧純元先生 聶雅倫先生 陳秀梅女士 吳燕安女士
（獨立非執行董事） （獨立非執行董事） （獨立非執行董事） （獨立非執行董事）
（主席）
（於2023年10月獲委任）
陳智思先生 包立賢先生 斐歷嘉道理先生 羅范椒芬女士 蔣東強先生
（獨立非執行董事） （非執行董事及 （非執行董事） （獨立非執行董事） （首席執行官）
董事會副主席） （於2023年5月退任） （於2023年10月獲委任，
並於2024年1月退任）
藍凌志先生 莊偉茵女士
（執行董事） （企業發展總裁）
（於2023年10月退任主席， （於2024年1月退任）
並於2024年1月退任）",
,"各現任成員的簡歷載於第82頁「董事會」及本公司網站。
於有關期間，委員會進行了改組，隨著首席執行官的繼任安排於2023年10月1日生效，顧純元
先生獲委任為委員會主席，而委員會亦自2024年1月1日起成為僅由非執行董事和獨立非執行董事
組成的委員會。委員會的職權範圍於2024年1月1日更新，委員會須由至少五名成員組成，其中
至少有三名成員為獨立非執行董事。
可持續發展管治已被納入集團企業管治架構之中，涵蓋董事委員會以至集團各職能部門的管理層
及業務單位（請參閱第98頁「企業管治報告」內的「中電的可持續發展匯報方式」一節）。
可持續發展委員會在監督集團可持續發展事宜的管理方面扮演主要角色。
管理層層面的可持續發展執行委員會負責監督管理層實施可持續發展相關策略、政策及目標，
以支援委員會的工作。集團可持續發展部就一系列可持續發展事宜向委員會及可持續發展執行
委員會作出匯報並尋求指引，有關事宜包括氣候行動、將可持續發展實務納入業務策略及規劃、
新出現的可持續發展風險及機遇，以及可持續發展和氣候相關匯報等。",
