主要趨勢和概要,,與集團業務之關連
健康與福祉,,
"2019冠狀病毒病疫情嚴重影響全球人類的健康與福祉。疫
情除嚴重干擾主要醫療服務，導致更多人患上焦慮症和抑鬱
症，縮短全球人口預期壽命外，更令推進更全面的健康保障
工作延誤20年。此外，疫情亦令身心健康面臨新威脅，包
括抗生素抗藥性問題、對疫苗接種的猶豫，以及氣候變化引
致的營養相關疾病及傳染病。精神健康狀況則或會因暴力、
貧窮及孤獨感等壓力來源增加而惡化。
根據世界經濟論壇的數據，未來十年在慢性疾病流行的大環
境下，傳染病的爆發將會更頻繁且廣泛傳播，令全球醫療系
統百上加斤，瀕臨崩潰。
由於疾病負擔增加、多個發達經濟體城市的人口老化，加上
創新科技擴大藥物治療的範疇，對醫療服務的強大需求會令
醫療系統長遠而言不勝負荷。世界衛生組織預測，於2030
年前全球醫護人員的短缺將會達到1,500萬人。
部分醫療系統更會經歷生產力衰退，原因是有經驗的工作人
員因精疲力竭及對員工與病人安全的憂慮而離職。技術及基
建設施的差距進一步削弱醫療系統的負荷能力，員工因裝備
或支援不足，疲於應付種種挑戰，導致針對薪資及人員調配
的罷工活動增加。",,"世界綠色建築委員會注意到，與人類健康、福祉及生活質
素有關的多項議題大部分由建築環境直接或間接造成。該
委員會於2020年11月引入健康及福祉架構，當中列出
締造健康且可持續發展建築環境的原則，為樓宇及建築界
提供指導框架，以便其履行涉及室內環境質素、身心健康
及對行為影響的責任。該架構亦強調，必須將建築生命週
期各個階段所涉及的人及環境因素都納入考慮。
樓宇及建築界（包括恒隆）在保障及提升持份者的安全與
健康方面可扮演積極角色，如為建築工人提供職安健保
障、預防疾病及提倡全人身心健康，以及透過慎選建材和
改善建築物的建造及營運方式，盡量減少對環境造成的負
面影響。
請參閱福祉及可持續交易章節了解我們的工作。"
地緣經濟衝突,,
"地緣經濟衝突對全球各國在可持續發展的重要議題上合作產
生巨大阻力，有關議題包括緩減及適應氣候變化、科技發展
與能源轉型，以及循環經濟方面的創新。
世界經濟論壇注意到，隨着各經濟大國之間的摩擦日漸增
加，經濟戰將會導致經濟政策方面的相應競爭。低效生產、
供應鏈受干擾及價格上升變得更趨頻繁。預期食品、能源及
安全風險相信亦會擴大。",,"地緣經濟衝突意味着全球供應鏈受干擾，亦會令政策及社
會經濟環境不穩，對營商構成影響，而商業及投資決定方
面亦會面臨不確定性。
為提升業務應對長期風險的能力，以及踏上可持續發展的
康莊大道，我們必須抱持嚴謹態度，同時高瞻遠矚，作好
萬全準備。
請參閲可持續管治一節了解我們的企業風險管理方針，而
我們提升資源生產力及建立更具彈性供應鏈的相關工作詳
情則分別載於資源管理及可持續交易章節。"
