參考段落,披露説明,參照及／或回應
,"(b) 管理層在用於監察、管理和監督氣候相關風險和機遇
的管治流程、控制措施和程序中扮演的角色，包括以下
方面的信息：
(i) 該角色是否已委派予特定的管理層職位或管理層委員
會，以及如何對該職位或委員會展開監督；及
(ii) 管理層有否應用控制措施和程序來協助監督氣候相關
風險和機遇；如有，這些控制措施和程序如何整合至其
他內部職能部門。","可持續交易
《可持續發展督導委員會職權範圍》
可持續發展督導委員會的角色
可持續發展督導委員會由董事會副董事長擔任主
席，成員包括各部門的資深員工代表，負責制訂、
統籌和實行應對氣候變化的策略，同時確保氣候相
關指標已轉換成年度環境、社會及管治關鍵績效
指標。可持續發展督導委員會定期召開會議（每年
最少兩次），詳細審視本集團在特定氣候相關指標
和年度環境、社會及管治關鍵績效指標方面取得的
進展，並負責詳細探討與氣候相關的風險和機遇，
包括隱含碳、能源效益、電動車、氣候變化實體風
險、碳定價、與租戶及其他持份者合作及其他方面
的相關議題。
可持續發展組的角色
可持續發展組定期向董事會（每年至少兩次）及副
董事長（每月至少一次）匯報應對氣候變化的最新
資訊，並協助制訂詳盡策略和落實環境、社會及管
治關鍵績效指標。可持續發展組亦負責在年度預算
編制的過程中，向行政總裁展示並匯報與可持續發
展相關的開支（包括資本支出及營運開支），例如
與應對氣候變化相關的開支。
企業風險管理工作小組的角色
企業風險管理工作小組由行政總裁擔任主席，每季
向審核委員會報告，負責統籌和監督本集團的風險
管理活動。氣候變化實體風險及轉型至低碳經濟的
風險均屬於企業風險管理工作小組所監察之企業層
面風險，而領導可持續發展組的行政人員則負責處
理這些氣候相關特定風險。"
策略,,
8,"在策略方面，氣候相關財務披露的目標是協助通用目的
財務報告的使用者了解實體用於管理氣候相關風險和機
遇的策略。",-
9,"具體而言，實體應披露相關信息，協助通用目的財務報
告的使用者了解以下各方面：
(a) 可合理預期將影響實體前景的氣候相關風險和機遇；",應對氣候變化 – 與氣候相關的風險和機遇
,"(b) 該等氣候相關風險和機遇對實體商業模式和價值鏈構
成的當前和預期影響；",應對氣候變化 – 與氣候相關的風險和機遇
,"(c) 該等氣候相關風險和機遇對實體策略和決策構成的影
響，包括有關其氣候相關轉型計劃的信息；","我們將於2024年底前公布的淨零路線圖中探討相
關議題。"
